{
  "$schema": "../../schemas/lake.schema.json",
  "id": "imja-tsho",
  "name": "Imja Tsho",
  "alternate_names": ["Imja Lake", "Imja Glacier Lake"],
  "country": "Nepal",
  "latitude": 27.8986111,
  "longitude": 86.9222222,
  "elevation_m": 5010,
  "watershed": "Imja Khola / Dudh Koshi",
  "downstream_river_system": "Imja Khola → Dudh Koshi → Koshi → Ganges",
  "geometry": {
    "type": "Polygon",
    "coordinates": [[[86.905, 27.887], [86.950, 27.887], [86.950, 27.911], [86.905, 27.911], [86.905, 27.887]]]
  },
  "aoi_status": "expanded_after_edge_clipping_review_requires_visual_validation",
  "geometry_version": "imja-expanded-aoi-v2-2026-08-28",
  "reviewed_reference_lake_envelope": {
    "path": "data/processed/imja-tsho/reference-candidates/2025-11-17_20251117T044959_20251117T045240_T45RVL_expanded-aoi.geojson",
    "source_observation": "data/processed/imja-tsho/2025-11-17.json",
    "status": "reviewed_for_v0_1_qa",
    "notes": "Generated from the November 2025 Sentinel-2 reference scene with the expanded AOI and visually checked in the Earth Engine Code Editor by the project operator. It is a QA observability envelope, not an authoritative shoreline. Re-review it whenever AOI or segmentation parameters change."
  },
  "sentinel2_qa": {
    "minimum_aoi_valid_fraction": 0.2,
    "minimum_lake_envelope_valid_fraction": 0.8,
    "outlier_comparison_max_age_days": 730,
    "outlier_minimum_elapsed_days": 30,
    "outlier_max_relative_area_change": 0.5
  },
  "optical_archive": {
    "season_start_month_day": "10-01",
    "season_end_month_day": "12-15",
    "historical_outlier_policy": "record_only",
    "notes": "Post-monsoon is an initial exploratory window, not an assertion of optimality. Scene-level QA is retained for all acquisitions; dates/windows can be changed for experiments. Historical temporal outliers are recorded but not automatically rejected because genuine early lake growth may be large."
  },
  "sentinel1_sar": {
    "instrument_mode": "IW",
    "polarization": "VV",
    "edge_mask_threshold_db": -30,
    "water_backscatter_threshold_db": -17,
    "minimum_lake_envelope_valid_fraction": 0.8,
    "minimum_component_area_km2": 0.05,
    "notes": "Initial validation parameters only. VV water threshold must be evaluated separately by orbit direction; do not treat SAR and optical values as interchangeable."
  },
  "seed_point": {
    "type": "Point",
    "coordinates": [86.9222222, 27.8986111]
  },
  "data_sources": [
    {"name": "Sentinel-2 Level-2A", "role": "recent optical lake-area estimates", "collection": "COPERNICUS/S2_SR_HARMONIZED"},
    {"name": "Landsat Collection 2 Level 2", "role": "historical optical lake-area estimates", "collection": "LANDSAT/LC08/C02/T1_L2"},
    {"name": "Sentinel-1 GRD", "role": "SAR validation candidates; never merged with optical series", "collection": "COPERNICUS/S1_GRD"}
  ],
  "notes": "The previous v0.1 draft reference (27°59′17″N) was visibly inconsistent with Imja Tsho and has been replaced with a literature-reported candidate reference of 27°53′55″N, 86°55′20″E. Coordinate sources disagree, so this remains requires_external_verification. The bounding AOI and seed point are initial processing aids, not an authoritative lake boundary; validate them against imagery before publishing measurements."
}
